{"boundary_sha256":"82f760705363669a842a096501eb50fdc209b581277db1b760b6da1b1e2f21e2","entrypoints":["tools/loom_qualification_manifest.py","tools/loom_qualification_v2.py","tools/loom_qualification_workload.py","tools/loom_suite_certificate_core.py"],"manifest_sha256":"023036859d90cc38698ced689aced99fa6301e06c3408f01e6417bb81b4cd87d","nodes":[{"dependencies":[],"kind":"contract","path":"contracts/release-qualification-boundary-v2.json","role":"shared-interface","sha256":"7b90441dff0ddc77652450111628a9ea29bda3bbc2db50855937454f34186735"},{"dependencies":[],"kind":"contract","path":"contracts/release-qualification-timing-profile-v2.json","role":"shared-interface","sha256":"2c2573fbabce84237634696b32b625cd9faca5057f1e17b03a2d6364b41e08ba"},{"dependencies":[],"kind":"contract","path":"contracts/release-qualification-workload-policy-v2.json","role":"shared-interface","sha256":"f39f50d1670e9b511ac950871a570b4d9a58017fcf6dd6f29e41fe3d107a8633"},{"dependencies":[],"kind":"contract","path":"contracts/release-suite-diagnostics-v1.json","role":"shared-interface","sha256":"4cb470ba50eac3254de9c640389d03f31f285fa4e6530a365e1bced605acfd03"},{"dependencies":[],"kind":"python","path":"qualification/workload-v2/fixture_support.py","role":"mechanism-repeat","sha256":"5a8df405035a6621c6fc4e97f1eeffa7200d574ce12497435e4f3b1e0c6487d8"},{"dependencies":[{"kind":"python-import","target":"qualification/workload-v2/fixture_support.py"}],"kind":"python","path":"qualification/workload-v2/test_qual_exclusive.py","role":"mechanism-repeat","sha256":"3c04a7d6ceb99f3f9ff9fb62bf3bb97c0be7ecd16d1be563582dfc49531aa9d3"},{"dependencies":[{"kind":"python-import","target":"qualification/workload-v2/fixture_support.py"},{"kind":"python-import","target":"tools/loom_suite_harness.py"}],"kind":"python","path":"qualification/workload-v2/test_qual_general_a.py","role":"mechanism-repeat","sha256":"70635d0f758bf332a280219410bc9914316c93d54d113993df578033108704b3"},{"dependencies":[],"kind":"python","path":"qualification/workload-v2/test_qual_general_b.py","role":"mechanism-repeat","sha256":"3916f652f832af78138feeb3254f475b96a57fbd927d0a39ca618419cb92716c"},{"dependencies":[{"kind":"python-import","target":"qualification/workload-v2/fixture_support.py"}],"kind":"python","path":"qualification/workload-v2/test_qual_serial.py","role":"mechanism-repeat","sha256":"7124b9e0f07c3d9025941210381788ffd46fc1ea72fcf5d38923e8193877f9d8"},{"dependencies":[],"kind":"schema","path":"schemas/exact-cut-ci-receipt-v2.schema.json","role":"shared-interface","sha256":"48f42ceceacd01af37d40d45a184b726fcf069da993492072ae141ffccdde02a"},{"dependencies":[],"kind":"schema","path":"schemas/release-authority-policy-v2.schema.json","role":"shared-interface","sha256":"f96da05a89aa9d0c159e802d260c6dfa7bfad3bc9e151294a627087c0ec9255c"},{"dependencies":[{"kind":"schema-ref","target":"schemas/exact-cut-ci-receipt-v2.schema.json"},{"kind":"schema-ref","target":"schemas/suite-matrix-certificate-v1.schema.json"}],"kind":"schema","path":"schemas/release-candidate-admission-v2.schema.json","role":"shared-interface","sha256":"e5b71019af40ddb38f6171c5c9cb3a493e9cb8bf49d399eb425976cb8d7a65c4"},{"dependencies":[],"kind":"schema","path":"schemas/release-candidate-equivalence-v2.schema.json","role":"shared-interface","sha256":"dcd7fa228cd7615db78baaa4962378179372a993ad3c13802ec25236712d49f2"},{"dependencies":[{"kind":"schema-ref","target":"schemas/release-qualification-observation-v2.schema.json"}],"kind":"schema","path":"schemas/release-mechanism-qualification-v2.schema.json","role":"shared-interface","sha256":"1f281ed58d831ea0e263268c9b2510ab37ef95feb4eb342d7d66fe80fbead58a"},{"dependencies":[],"kind":"schema","path":"schemas/release-qualification-boundary-v2.schema.json","role":"shared-interface","sha256":"59faf50acc81d66682733340916875b62b750e6b8da13b15fa6f777087b40624"},{"dependencies":[],"kind":"schema","path":"schemas/release-qualification-manifest-v2.schema.json","role":"shared-interface","sha256":"94eb0489618ffae0ed6063bdfbaf46ed7fe028b900835c6899756f0eb75f2447"},{"dependencies":[{"kind":"schema-ref","target":"schemas/suite-cell-certificate-v1.schema.json"},{"kind":"schema-ref","target":"schemas/suite-inventory-v1.schema.json"},{"kind":"schema-ref","target":"schemas/suite-shard-plan-v1.schema.json"},{"kind":"schema-ref","target":"schemas/suite-worker-receipt-v1.schema.json"}],"kind":"schema","path":"schemas/release-qualification-observation-v2.schema.json","role":"shared-interface","sha256":"9d88e1c431b75773d1beeded5c593e4eb7e675d5638a9b0b6c899f0895284379"},{"dependencies":[],"kind":"schema","path":"schemas/release-qualification-timing-profile-v2.schema.json","role":"shared-interface","sha256":"a17527a0021fcc0dfe80b2619cbeaf6eb9b3f370188e3232ac3159e3ef930b2a"},{"dependencies":[],"kind":"schema","path":"schemas/release-qualification-workload-policy-v2.schema.json","role":"shared-interface","sha256":"2809d3f0e9df41705ab3af97b4ed1c89e8a3f9ba5e9f634c56ee4b2d14547250"},{"dependencies":[],"kind":"schema","path":"schemas/release-suite-diagnostics-v1.schema.json","role":"shared-interface","sha256":"0aa542ce802e406a147796b5280cc87b637185d946a7e3e4933cbf0b6722a089"},{"dependencies":[],"kind":"schema","path":"schemas/suite-cell-certificate-v1.schema.json","role":"shared-interface","sha256":"368f5698c5076b1ae8077619ef1877b647c91be73ba260c1e0d5378890491bd2"},{"dependencies":[],"kind":"schema","path":"schemas/suite-failure-diagnostic-v1.schema.json","role":"shared-interface","sha256":"19f2bba460c71261ef48611d444dcd0ce5ff57222028872cdd0674b4754856ab"},{"dependencies":[],"kind":"schema","path":"schemas/suite-inventory-v1.schema.json","role":"shared-interface","sha256":"c6c1512fa9a98f93015378493c178bb397ff2e392e77e4d0da3011b3b172f479"},{"dependencies":[{"kind":"schema-ref","target":"schemas/suite-cell-certificate-v1.schema.json"}],"kind":"schema","path":"schemas/suite-matrix-certificate-v1.schema.json","role":"shared-interface","sha256":"887eda6c10f074e96fdf52368fd252dfc31a6c5bc0ae080f70b010cb1b716b32"},{"dependencies":[],"kind":"schema","path":"schemas/suite-shard-plan-v1.schema.json","role":"shared-interface","sha256":"938e2b259202df40fae4390f850aa4de176295f7d2e5c812624923ff3b7a9626"},{"dependencies":[],"kind":"schema","path":"schemas/suite-worker-receipt-v1.schema.json","role":"shared-interface","sha256":"fa2772be7bf88dd72bb9ceb244f050e0918be2bd5dde5f4c13ba2bc4c533284e"},{"dependencies":[{"kind":"python-import","target":"tools/loom_reliability.py"}],"kind":"python","path":"tools/loom_cut_manifest.py","role":"mechanism-repeat","sha256":"2877545104308574aa1384b8f38b72e3d755b9785febc966f877bbf3889889f1"},{"dependencies":[{"kind":"declared-data","target":"schemas/exact-cut-ci-receipt-v2.schema.json"},{"kind":"python-import","target":"tools/loom_suite_harness.py"}],"kind":"python","path":"tools/loom_exact_cut_receipt.py","role":"mechanism-repeat","sha256":"121355ffec38202268643452124aa2a617b0fb007eaa3fb852a30712377c6c6a"},{"dependencies":[],"kind":"python","path":"tools/loom_operation_supervisor.py","role":"mechanism-repeat","sha256":"78bf58c3be5afab1592906c4f0dd780314b99847ff2f50acb3f2d4cb97119c51"},{"dependencies":[{"kind":"process-invocation","target":"tools/loom_publication_privacy.py"},{"kind":"python-import","target":"tools/loom_reliability.py"}],"kind":"python","path":"tools/loom_publication_privacy.py","role":"mechanism-repeat","sha256":"3aa02384ce1b067839c3c2c7cebb73925f8ec8f8b40224b5d8218dd8cd124b30"},{"dependencies":[{"kind":"declared-data","target":"contracts/release-qualification-boundary-v2.json"},{"kind":"declared-data","target":"schemas/release-qualification-boundary-v2.schema.json"},{"kind":"declared-data","target":"schemas/release-qualification-manifest-v2.schema.json"},{"kind":"python-import","target":"tools/loom_reliability.py"}],"kind":"python","path":"tools/loom_qualification_manifest.py","role":"shared-interface","sha256":"e4cc8d974ae35becfffafcf5f59fd35446aaaea21d5d613f1489a71d29d71506"},{"dependencies":[{"kind":"declared-data","target":"schemas/release-authority-policy-v2.schema.json"},{"kind":"declared-data","target":"schemas/release-candidate-admission-v2.schema.json"},{"kind":"declared-data","target":"schemas/release-candidate-equivalence-v2.schema.json"},{"kind":"declared-data","target":"schemas/release-mechanism-qualification-v2.schema.json"},{"kind":"declared-data","target":"schemas/release-qualification-observation-v2.schema.json"},{"kind":"python-import","target":"tools/loom_exact_cut_receipt.py"},{"kind":"python-import","target":"tools/loom_qualification_manifest.py"},{"kind":"python-import","target":"tools/loom_qualification_workload.py"},{"kind":"python-import","target":"tools/loom_subject_identity.py"},{"kind":"python-import","target":"tools/loom_suite_certificate_core.py"},{"kind":"python-import","target":"tools/loom_suite_plan.py"},{"kind":"python-import","target":"tools/loom_suite_worker.py"}],"kind":"python","path":"tools/loom_qualification_v2.py","role":"mechanism-repeat","sha256":"70fef06c0e1236fc19543f76f08f40c699a4afaf396b8a0256936254e91a26ba"},{"dependencies":[{"kind":"data-set-member","target":"qualification/workload-v2/fixture_support.py"},{"kind":"data-set-member","target":"qualification/workload-v2/test_qual_exclusive.py"},{"kind":"data-set-member","target":"qualification/workload-v2/test_qual_general_a.py"},{"kind":"data-set-member","target":"qualification/workload-v2/test_qual_general_b.py"},{"kind":"data-set-member","target":"qualification/workload-v2/test_qual_serial.py"},{"kind":"declared-data","target":"contracts/release-qualification-timing-profile-v2.json"},{"kind":"declared-data","target":"contracts/release-qualification-workload-policy-v2.json"},{"kind":"declared-data","target":"schemas/release-qualification-timing-profile-v2.schema.json"},{"kind":"declared-data","target":"schemas/release-qualification-workload-policy-v2.schema.json"},{"kind":"python-import","target":"tools/loom_cut_manifest.py"},{"kind":"python-import","target":"tools/loom_qualifica